search_term,post_id,creator,posted_date,likes,comments,hashtags,caption,image_description,post_url,status
"#foodlover","CeNYorJADwo","foodfuunn","May 31, 2022","825","2","#homemadefood #food #foodie #foodporn #foodlover #yummy #delicious","for food lovers - follow me for more","Cooking video - pouring melted butter over pastry/bread on baking tray","https://www.instagram.com/p/CeNYorJADwo/","SCRAPED"
"#foodlover","BuBzo_Fl_Sw","thafoodgramz","February 18, 2019","252","25","#foodlover #foodyfetish","Pizza-burger! by @foodyfetish - Tag all Food lovers","Pizza-burger - burger patty with melted cheese and pepperoni in bun","https://www.instagram.com/p/BuBzo_Fl_Sw/","SCRAPED"
"#foodlover","CpKl5_4NIfX","dilanatandoor","February 27, 2023","9","0","#FoodieLife #FoodPorn #FoodLover #YumYum #FoodGram #FoodLovers","Food Lovers","Julia Child quote graphic - People who love to eat are always the best people","https://www.instagram.com/p/CpKl5_4NIfX/","SCRAPED"
"#yummy","DSSCe4ElV-8","jon_and_dean","December 15, 2025","2322","96","#yummy #chicken #crispy #recipe #foodie","Crispy chicken recipe with buttermilk, flour, cornstarch, sriracha, garlic powder, panko breadcrumbs","Crispy fried chicken nuggets/tenders with dipping sauce","https://www.instagram.com/p/DSSCe4ElV-8/","SCRAPED"
"#yummy","DQhfdYWjbjd","nicolekochtleicht","November 1, 2025","1898","","#nicolekochtleicht #dessau #rezept #rezeptidee #essen #yummy #onepotpasta #pastalover","German one-pot pasta recipe - Nudel Onepot mit Gehacktes und Käsesauce","Penne pasta in creamy cheese sauce with ground meat","https://www.instagram.com/p/DQhfdYWjbjd/","SCRAPED"
"#yummy","DRFUFxJjJ1b","cowboychrisdorrah","November 15, 2025","2050","16","#yummy #pasta #italianfood #recipe","One-pot creamy Italian beef and spaghetti - detailed recipe with olive oil, ground beef, crushed tomatoes, heavy cream, parmesan","Creamy spaghetti with ground beef and tomatoes garnished with basil","https://www.instagram.com/p/DRFUFxJjJ1b/","SCRAPED"
"#yummy","DTQTGQXjBEe","yesimozyurtozcelik61","January 9, 2026","2990","","#yeşim61 #yummy #dostluk #tatlı #ocakhuzur","BURMALI - Turkish baklava recipe with tereyağ, yoğurt, nişasta, kabartma tozu, şerbeti","Baklava rolls arranged in round pan with syrup","https://www.instagram.com/p/DTQTGQXjBEe/","SCRAPED"
"#yummy","DP2WgsQDme4","yummyrecipes_01","October 16, 2025","1249","6","#yummy #naan #buttternaan #recipe #indian","Easy Butter Naan Recipe - Soft & Fluffy Homemade Naan with flour, sugar, yeast, butter, milk","Fluffy butter naan in pan with recipe overlay","https://www.instagram.com/p/DP2WgsQDme4/","SCRAPED"
"#yummy","DQZuuKijKdM","5.dakikalik.kurabiyeler","October 29, 2025","2334","","#yummy #kurabiye #cookies #turkish","KARTOPU KURABIYE - Snowball Cookies with tereyağ, pudra şekeri, nişasta, vanilya, beyaz çikolata, hindistan cevizi","White coconut-covered cookies (Snowball cookies)","https://www.instagram.com/p/DQZuuKijKdM/","SCRAPED"
"#yummy","DSfy2xjgr_O","belgince_borek_butikpasta","December 21, 2025","1978","","#trabzon #dereotlupoğaça #yummy #keşfet","DEREOTLU SANDVİÇ POĞAÇA - Turkish savory pastry with dill, tereyağ, yoğurt, un, labne","Turkish sesame-topped pastries with cream cheese filling","https://www.instagram.com/p/DSfy2xjgr_O/","SCRAPED"
"#yummy","DQLnHC0iaCQ","khana_peena_yumm","October 24, 2025","41220","","#punjab #saag #makkiroti #punjabiculture #yummy #lovepunjab","Traditional Punjabi dish - makki ki roti with sarson ka saag","Makki ki roti (corn flatbread) with sarson ka saag (mustard greens) and green chilli","https://www.instagram.com/p/DQLnHC0iaCQ/","SCRAPED"
"#yummy","DTCnLLQCFHy","bhukkar_foodiee","January 3, 2026","","","#foodie #foodblogger #yummy #hunger #cravings","Soya chunks - simple, tasty & yummy recipe, very simple and easy to make","Soya chunks stir fry with peppers and vegetables in a bowl","https://www.instagram.com/p/DTCnLLQCFHy/","SCRAPED"
"#yummy","DQYrIjuDCOK","konditornsbak","October 30, 2025","1401","","#yummy #baking #kladdkaka #swedish","Hallongrotta som kladdkaka - Swedish raspberry jam swirl brownie cake recipe","Raspberry jam swirl cake with slices cut showing swirl pattern","https://www.instagram.com/p/DQYrIjuDCOK/","SCRAPED"
"#delicious","DTYQ04PlMRv","jon_and_dean","January 12, 2026","131","N/A","#chicken #soup #marrymechicken #comfortfood #delicious #recipe","Creamy Marry Me Chicken Soup - comfort food recipe with sun-dried tomatoes and spinach","Creamy chicken soup in pan with sun-dried tomatoes and spinach","https://www.instagram.com/p/DTYQ04PlMRv/","SCRAPED"
"#delicious","DRpVOjmCM7A","frenchfamilyfood","November 29, 2025","4275","N/A","#meatballs #pork #potatoes #frenchfood #recipe #delicious","Pork meatballs with potatoes - French family recipe","Pork meatballs with potatoes in baking dish","https://www.instagram.com/p/DRpVOjmCM7A/","SCRAPED"
"#delicious","DQSJrXZErhS","globaledible","October 27, 2025","2210","32","#brie #pistachio #appetizer #cranberry #holiday #delicious","Pistachio-Crusted Brie Bites with cranberry topping - holiday appetizer","Pistachio-crusted brie bites with cranberry sauce on white plate","https://www.instagram.com/p/DQSJrXZErhS/","SCRAPED"
"#delicious","DTZmsHjiElt","trenettepennetteunqbdifantasi","January 12, 2026","857","N/A","#senzaglutine #crostatasenza #food #instafood #foodporn #foodie #yummy #delicious #foodphotography #homemade #cucinaitaliana #italianfood #foodlover #tasty #foodblogger #foodstagram #foodbloggeritalia #food_super_pics #HomeBaking","Gluten-free pasta dough recipe with oil and yogurt for biscotti and crostate","Smooth dough ball on wooden cutting board with rolling pin","https://www.instagram.com/p/DTZmsHjiElt/","SCRAPED"
"#delicious","DQmokaTEvI8","fooduice.snack","November 3, 2025","N/A","N/A","#EasyRecipe #Seafood #Foodie #ComfortFood #Veggies #Sausage #Shrimp #Delicious","Honey garlic shrimp, sausage, and broccoli - easy recipe with full instructions","Shrimp, sausage rounds, and broccoli on white plate","https://www.instagram.com/p/DQmokaTEvI8/","SCRAPED"
"#delicious","DQzjTwVjJnj","woottoncoffeeshop","November 8, 2025","4602","N/A","#woottoncoffeeshop #northampton #acai #northamptonshire #supportlocalbusinesses #acaibowl #granola #newmenuitemu #delicious #wootton #woottoneats #newmenuitem #northamptonacai","All four açai bowls - pistachio paradise, golden lotus, berry choc crunch, pb ocean breeze","Four açai bowls with various toppings including mango, berries, chocolate, nuts","https://www.instagram.com/p/DQzjTwVjJnj/","SCRAPED"
"#delicious","DTYKt1vDYq8","thesaltychilli","January 12, 2026","578","N/A","#chicken #dinner #delicious #easymeals #ricebowl","Crispy Marinated Chicken with Savoury Ginger Scallion Sauce and Sambal - family meal recipe","Crispy chicken with rice, ginger scallion sauce, and sambal on plate","https://www.instagram.com/p/DTYKt1vDYq8/","SCRAPED"
"#delicious","DPySYBoiGEi","pranz.0cena","October 14, 2025","3035","N/A","#pasta #broccoli #taleggio #italianfood #delicious #recipe","Italian broccoli pasta with taleggio fonduta - detailed preparation steps","Green broccoli pasta with creamy sauce, breadcrumbs, and sage leaves","https://www.instagram.com/p/DPySYBoiGEi/","SCRAPED"
"#delicious","DQvTIKZj0l6","deliciousaus","November 7, 2025","1234","N/A","#delicious #Zuppainglese #trifle #dessertrecipe","Zuppa inglese - Italian celebration trifle with sponge cake, lemon curd, strawberry syrup, mascarpone and raspberries","Raspberry trifle (zuppa inglese) in crystal bowl with fresh raspberries on top","https://www.instagram.com/p/DQvTIKZj0l6/","SCRAPED"
"#delicious","DQxWcBGjVZQ","turko_hanim_mutfakta","November 8, 2025","1345","N/A","#instafood #TagsForLikes #yummy #amazing #instagood #photooftheday #sweet #dinner #lunch #breakfast #tasty #food #delish #delicious #eating #foodpic #foodpics #eat #hungry #foodgasm #foods #yemektarifleri #yemekblogu #yemek #sunumonerileri #sunum #sofra #sofrasunumu #gurme","Turkish spinach börek (Ispanaklı el açma börek) with detailed recipe instructions","Turkish spinach börek cut into triangular pieces on plate","https://www.instagram.com/p/DQxWcBGjVZQ/","SCRAPED"
"#dinner","DTQTfPtDAW5","anna_s_table","January 9, 2026","847","N/A","#chicken #dinner #homecooking #comfortfood #foodie","Honey Butter Garlic Chicken - crispy pan-fried chicken thighs with honey butter garlic sauce","Golden crispy chicken thighs in a honey butter garlic glaze with herbs","https://www.instagram.com/p/DTQTfPtDAW5/","SCRAPED"
"#dinner","DSvtd5Ck31S","bakerbynature","December 27, 2025","1469","N/A","#seafood #cod #dinner #healthyeating #foodphotography","Pan-Seared Cod with lemon butter sauce and fresh herbs","Pan-seared white cod fillet with golden crust, lemon slices and herbs","https://www.instagram.com/p/DSvtd5Ck31S/","SCRAPED"
"#dinner","DPufDJtDXIo","thegreeneggeffect","October 13, 2025","145","N/A","#tacos #eggrolls #fusion #dinner #appetizer","Taco Eggrolls - crispy fusion appetizer combining taco flavors in eggroll wrapper","Golden crispy eggrolls filled with seasoned taco meat, cut in half showing filling","https://www.instagram.com/p/DPufDJtDXIo/","SCRAPED"
"#dinner","DMIi2WER8MR","jon_and_dean","July 15, 2025","3920","N/A","#rice #frenchonion #dinner #comfortfood #sidedish","French Onion Butter Rice - caramelized onions with buttery rice","Creamy buttery rice with caramelized onions and melted cheese on top","https://www.instagram.com/p/DMIi2WER8MR/","SCRAPED"
"#dinner","DNYJvqGuxzY","juliasalbumblog","August 15, 2025","736","N/A","#gnocchi #mushroom #pasta #dinner #vegetarian","Creamy Mushroom Gnocchi - pillowy gnocchi in creamy mushroom sauce","Soft potato gnocchi in creamy sauce with sautéed mushrooms and herbs","https://www.instagram.com/p/DNYJvqGuxzY/","SCRAPED"
"#dinner","DRaaRDMiDb8","cookingwithrichh","November 24, 2025","74339","576","#steak #pasta #dinner #rigatoni #foodporn","Steak Bites with Creamy Rigatoni - tender steak pieces with pasta in cream sauce","Juicy seared steak bites served with creamy rigatoni pasta, garnished with parsley","https://www.instagram.com/p/DRaaRDMiDb8/","SCRAPED"
"#dinner","DQ93q-fjMX3","_chrisinthekitchen","November 13, 2025","N/A","N/A","#chicken #cajun #hothoney #dinner #spicy","Hot Honey Cajun Chicken - crispy chicken with sweet and spicy hot honey glaze","Crispy fried chicken pieces drizzled with hot honey and cajun seasonings","https://www.instagram.com/p/DQ93q-fjMX3/","SCRAPED"
"#dinner","DP6Wf1wjflm","thereciperebel","October 17, 2025","1961","N/A","#soup #pasta #tomato #dinner #comfortfood","Tomato Macaroni Soup - hearty soup with elbow macaroni in tomato broth","Bowl of tomato-based soup with elbow macaroni, carrots, and vegetables","https://www.instagram.com/p/DP6Wf1wjflm/","SCRAPED"
"#dinner","DRqCs2uAEz8","quotidianrecipes","November 30, 2025","494","N/A","#mexican #chicken #casserole #dinner #comfortfood","Mexican Chicken Casserole - layers of chicken, beans, cheese and tortillas","Cheesy casserole dish with shredded chicken, black beans, and Mexican spices","https://www.instagram.com/p/DRqCs2uAEz8/","SCRAPED"
"#dinner","DQHNJqCjAlq","ketodietfirst_","October 22, 2025","1541","N/A","#ketodietfirst_ #food #instachef #keto #ketoaf #dinner #ketosnacks #gourmetfood #foodporn #chef #healthymeal #ketofriendly #ketofam #ketocommunity","Healthy Veggie & Ground Meat Rice Bowl - 540 kcal, 33g protein, 48g carbs","Rice bowl with white rice, ground meat, broccoli, mushrooms, zucchini, and red bell pepper","https://www.instagram.com/p/DQHNJqCjAlq/","SCRAPED"
"#brunch","DMulFcooJDG","eggbreak_ldn","July 30, 2025","383","22","#eggbreak #eggseggseggs #nottinghill #brunch","House Salmon Fishcakes topped with poached eggs, sriracha, hollandaise, and spinach - returning to menu soon","Salmon fishcakes with poached eggs and orange hollandaise sauce with spinach","https://www.instagram.com/p/DMulFcooJDG/","SCRAPED"
"#brunch","DRB77KvDAyt","cafebriepk","November 14, 2025","65","1","#brunch #breakfastvibes #breakfast #jazzvibes","You simply must join me for brunch at this darling new place, I hear the coffee's heavenly and the croissants are to die for!","Full brunch spread with blueberry pancakes, sunny-side up eggs, waffles, salad, croissants, orange juice, coffee","https://www.instagram.com/p/DRB77KvDAyt/","SCRAPED"
"#brunch","DOMvZwLid1y","timbakerbrasil","September 5, 2025","161","8","#brownie #cookies #campinas #applepie #americansweets #custard #cafe #coffee #bagel #brunch #biscuits #timbakercafe","PANCAKE BREAKFAST IS BACK! Special weekend brunch with pancakes and maple butter or blueberries","Fluffy pancakes with blueberry compote, bacon strips, scrambled eggs, and toast","https://www.instagram.com/p/DOMvZwLid1y/","SCRAPED"
"#brunch","DNK6c03BOQL","chefsam83","August 10, 2025","2020","N/A","#beef #pulledbeef #brisket #brunch #sydney #australia #avocado #sourdough #cherrytomato","Pulled beef on brioche - one of the best","Pulled beef brisket on brioche toast with avocado smash, microgreens, and cherry tomatoes","https://www.instagram.com/p/DNK6c03BOQL/","SCRAPED"
"#brunch","DOISDCgjHsC","barnaclesrestaurant","September 3, 2025","45","1","#weekendbrunch #BarnaclesBrunch #brunchmenu #brunchgoals #brunch #smokedsalmon #avocado #fullenglish #pastry","Weekend Brunch at Barnacles - smoked salmon, avocado, eggs, full English, sweet treats","Eggs benedict with smoked salmon and scrambled eggs on toasted bread with microgreens","https://www.instagram.com/p/DOISDCgjHsC/","SCRAPED"
"#brunch","DRHoGpLkdms","lakeside.grazing","November 16, 2025","51","12","#lakesidegrazingandevents #brunchplease #brunch #pancakedreams #charcuterie #foodie #niagarafood #graze #supportlocal","Sunday brunch just got sweeter - try our new mini pancake and waffle boards","Mini pancake stacks and waffles topped with fresh berries on wooden boards","https://www.instagram.com/p/DRHoGpLkdms/","SCRAPED"
"#brunch","DRXBizzDHw3","caramellocafes","November 22, 2025","921","18","#frenchtoast #dessert #brunch #didsbury #foodporn","Warm up those cold winter days with our berry-loaded French toast - soft, sweet, and straight from the grill","Golden French toast slices topped with fresh berries, whipped cream, and berry sauce","https://www.instagram.com/p/DRXBizzDHw3/","SCRAPED"
"#brunch","DQJeT_KE1WV","annieeathappy","October 23, 2025","182","56","#brunch #lazytobybkk #bangkok #foodie","Brunch done right at Lazy Toby's - colorful and delicious","Colorful brunch platter with salmon, avocado, eggs benedict, salad, toast, olives, tomatoes","https://www.instagram.com/p/DQJeT_KE1WV/","SCRAPED"
"#brunch","DQlEvwzjxvx","aoraustin","November 3, 2025","17","N/A","#GoodMorning #Breakfast #Brunch #EggBenedict","A Thai-inspired twist on a brunch classic - Egg Benedict with fragrant herbs and local flavor","Elegant eggs benedict with smoked salmon, orange juice and cappuccino","https://www.instagram.com/p/DQlEvwzjxvx/","SCRAPED"
"#brunch","DQ1qRa1EaKz","clintonstbakingco","November 9, 2025","1141","10","#sundaybrunch #brunch #brunching #clintonstbakingco #bestbrunch","Sunday brunch 101.","Full brunch spread with pancakes, eggs, French toast, fruit salad, sausage, coffee, and orange juice","https://www.instagram.com/p/DQ1qRa1EaKz/","SCRAPED"
"#finedining","C5U0s9ZBCjt","miarecipes6","April 4, 2024","9","0","#finedining #foodphotography #gourmet","Tournedos Rossini - classic fine dining dish","Tournedos Rossini - beef tenderloin with foie gras and truffle sauce on plate","https://www.instagram.com/p/C5U0s9ZBCjt/","SCRAPED"
"#finedining","DK2YrPjqtdJ","selow_lifestyle","June 13, 2025","4677","215","#finedining #lobster #gourmet","Silky Lobster Sauce fine dining presentation","Lobster in creamy sauce - fine dining seafood presentation","https://www.instagram.com/p/DK2YrPjqtdJ/","SCRAPED"
"#finedining","DPahacpgMpT","plated.poetry1","October 5, 2025","5389","0","#finedining #plating #culinary","Chicken Roulade with Beetroot fine dining","Chicken roulade with beetroot puree and microgreens on white plate","https://www.instagram.com/p/DPahacpgMpT/","SCRAPED"
"#finedining","DKSAKltTn8f","hady_nabil","May 30, 2025","1922","0","#finedining #venison #gourmet","Crusted Venison Saddle presentation","Herb crusted venison with multiple sauce presentations","https://www.instagram.com/p/DKSAKltTn8f/","SCRAPED"
"#finedining","DSCQYCgkSvS","hungryjug","December 9, 2025","15","0","#petitfour #finedining","Petit Four dessert presentation","Fine dining petit four - 4 small pastries on beige plate","https://www.instagram.com/p/DSCQYCgkSvS/","SCRAPED"
"#finedining","DTNQdNFjPI9","breez_santorini","January 6, 2026","12","0","#HerbCrustedTenderloin #GreekRoastedTomatoSoup #FineDining #SteakLovers","Herb Crusted Tenderloin with Greek Roasted Tomato Soup","Grilled tenderloin steak with corn, potatoes and tomato soup","https://www.instagram.com/p/DTNQdNFjPI9/","SCRAPED"
"#finedining","DQpGQJHDIs7","grandhotelpupp","November 4, 2025","261","0","#grandhotel #karlovyvary #firstclassexperience #carlsbad #elegance #fivestar #grandhotelpupp #finedining","Grand Hotel Pupp fine dining table spread","Overhead view of elegant fine dining table with multiple courses","https://www.instagram.com/p/DQpGQJHDIs7/","SCRAPED"
"#finedining","DSXM1LAjGbR","sarahpuozzo","December 17, 2025","76","7","#50topitaly #italiaansekeuken #gastronomiaitaliana #restaurant #finedining","Italian fine dining - 50 Top Italy Restaurants 2025","Lobster pasta dish on brown plate - Italian fine dining","https://www.instagram.com/p/DSXM1LAjGbR/","SCRAPED"
"#finedining","DSmJj41kQKB","donnabelleofficial","December 23, 2025","20","0","#FineDining #CulinaryArt #GourmetFood","Where every layer is placed with purpose","Chef hands plating layered pasta dish with microgreens","https://www.instagram.com/p/DSmJj41kQKB/","SCRAPED"
"#finedining","DHsFt6LTESf","jffff___","March 27, 2025","318","0","#finedining #casualdining #pasta","Casual fine dining restaurant review","Creamy mushroom pasta being lifted with fork","https://www.instagram.com/p/DHsFt6LTESf/","SCRAPED"
"#streetfood","COf1LOIpLNN","binjalsvegkitchen","May 5, 2021","7796","129","#streetfood #elotes #mexicanfood","Grilled Mexican Street Corn - Elotes with lime and cotija cheese","Grilled Mexican street corn with spices and toppings","https://www.instagram.com/p/COf1LOIpLNN/","SCRAPED"
"#streetfood","CmMLRamy9EL","foody_abba","December 15, 2022","86475","75","#kolkatastreetfood #streetfood #kolkatafood #chaat","Street food of Kolkata is love","Kolkata chaat with sev and pani puri on plate","https://www.instagram.com/p/CmMLRamy9EL/","SCRAPED"
"#streetfood","DTaj-H4E8sB","thefoodiepoet_","January 12, 2026","153","72","#explorepage #foodblogger #streetfood #delhiblogger","Tikki khalo guy's - Delhi street food","Delhi tikki chaat with chutneys in silver container","https://www.instagram.com/p/DTaj-H4E8sB/","SCRAPED"
"#streetfood","BuLBBZfncUE","foodmaniacindia","February 22, 2019","10230","15","#mumbaistreetfood #streetfood #indianstreetfood","Cheese Chilli Toast Sandwich - Mumbai street food","Mumbai cheese chilli toast sandwich on paper plate","https://www.instagram.com/p/BuLBBZfncUE/","SCRAPED"
"#streetfood","DPjF40pjwvj","foodieharshi","October 8, 2025","7333","15","#streetfood #momos #friedmomos #foodtalkindia","This weather and fried momos","Fried momos with dipping sauces in silver tray","https://www.instagram.com/p/DPjF40pjwvj/","SCRAPED"
"#streetfood","DO8vEQ_jCPv","flavour_e_ishq","September 23, 2025","2818","0","#Panipuri #GolGappa #IndianStreetFood #StreetFood #Chaat","The ultimate street food!","Pani puri/golgappa with sev and vegetables","https://www.instagram.com/p/DO8vEQ_jCPv/","SCRAPED"
"#streetfood","DTbpPeWklwR","agoraeprasempre2018","January 13, 2026","1101","1","#gimbap #myeongdong #koreanfood #seoulfood #streetfood","Korean gimbap at Myeongdong","Korean gimbap rolls with egg and vegetables","https://www.instagram.com/p/DTbpPeWklwR/","SCRAPED"
"#streetfood","DMSGdZRzb4a","aswelovefood","July 19, 2025","97","0","#vadapav #mumbaistreetfood #streetfood #indianstreetfood","Mumbai vada pav at CSMT","Mumbai vada pav with CSMT building in background","https://www.instagram.com/p/DMSGdZRzb4a/","SCRAPED"
"#streetfood","Bf7J5mGHKMo","indulgenteats","March 5, 2018","3046","0","#IndulgentEatsPhuket #IndulgentVideos #IndulgentEatsThailand","Thai street food at Phuket Weekend Market","Colorful Thai street food dumplings - purple green white","https://www.instagram.com/p/Bf7J5mGHKMo/","SCRAPED"
"#streetfood","DMvb7snMhfp","hungryolivethethyme","July 30, 2025","382","30","#naanstaap #leicesterfood #streetfood #indianstreetfood #halalfood","Naan Staap Leicester - Desi Street Food","Indian street food spread - stuffed naans and channa","https://www.instagram.com/p/DMvb7snMhfp/","SCRAPED"
"#foodporn","DRpw2OVCKe3","cookingwithrichh","November 30, 2025","9589","","#isleofwight #tortellini #pastarecipes #steaklover #alfredosauce #foodie #cookingwithrichh #foodporn #steak","Rich and creamy steak tortellini in garlic parmesan sauce","Steak pieces with creamy tortellini in garlic parmesan alfredo sauce on dark plate","https://www.instagram.com/p/DRpw2OVCKe3/","SCRAPED"
"#foodporn","DSP1EMpjOyD","sana_foodmedia","December 14, 2025","311846","","#sanafoodmediarice #food #foodporn #instafood #sana_foodmedia","Tag the person whose birthday is coming and biryani is it's favourite","Biryani rice dish shaped like birthday cake with candle on top text overlay Meray Dost Happy Birthday","https://www.instagram.com/p/DSP1EMpjOyD/","SCRAPED"
"#foodporn","DTQBCkEiMD5","chillyseedskitchen","January 9, 2026","3189","","#Chutney #schezwanchutney #Lehsunchutney #foodporn #chillyseedsktichen","Winter Special Chutneys Schezwan Chutney Moli Tamatar Amla Rajasthani garlic Saurashtra farsan","Red chili peppers in glass jar being prepared for chutney","https://www.instagram.com/p/DTQBCkEiMD5/","SCRAPED"
"#foodporn","DQZTCDaEn7Q","tastytreaat","October 29, 2025","6695","","#food #foodporn #foodphotography #foodstagram #yummy #yummyfood #foodlover #cheeselover #cheeseburgers #pizza #pizzalover #bread #healthyfood #burgerlove #burgersofinstagram #bbq #meatpies #foodblogger #foodevent #spicy #londonfoodposts #disneyfood #brisbanefood #foodyid #chickenburger #burgermasterco #londonfoodie","Yummy Which one you prefer? Comment down Tag a food lover What I want rn","Loaded cheese fries with bacon and cheese sauce drizzled on top","https://www.instagram.com/p/DQZTCDaEn7Q/","SCRAPED"
"#nycrestaurants","DF5mHNDgca9","newyorkfeature","February 10, 2025","302","7","","A NYC Pizza Date with a View. Photo by @notre.choix. Cecconi's Dumbo is a stylish Italian restaurant located on the waterfront in Brooklyn offering stunning views of the Manhattan skyline.","Pizza date at waterfront restaurant with Brooklyn Bridge and Manhattan skyline view, two wood-fired pizzas on table with wine","https://www.instagram.com/p/DF5mHNDgca9/","SCRAPED"
"#nycrestaurants","C_Q7LKeoUBb","elainewhiteley","August 30, 2024","244","","#cafecarmellini #martinbrudnizki #newyorkrestaurants #fifthavenue #eateries #nycrestaurants #restaurantsofinsta #bestrestaurants #italianrestaurant #italianfood #newyorkfood #restaurantinteriors","Look at the layers of interior design by Martin Brudnizki in Cafe Carmellini on Fifth Avenue New York. He is an inspired designer","Elegant restaurant interior with circular chandelier, lush greenery, and sophisticated white-clothed tables at Cafe Carmellini","https://www.instagram.com/p/C_Q7LKeoUBb/","SCRAPED"
"#nycrestaurants","DOMRHBsARZ7","limusinanyc","September 5, 2025","400","","#nyceats #nycfoodie #mexicanfood #nycrestaurants #newrestaurant","Reservations are live @opentable","Red-themed restaurant interior with hanging lanterns, dramatic lighting, and communal seating at Limusina","https://www.instagram.com/p/DOMRHBsARZ7/","SCRAPED"
"#nycrestaurants","DOje_WBESHP","valbellaatthepark","September 14, 2025","122","","#rooftopnyc #Midtownrooftop #finediningnyc #cocktailsnyc #manhattandining #nycrestaurants #nycrooftopbar #nycrooftop #nyccocktails #valbellaatthepark #upscaledining #nycdining #nycrestaurant","Welcome to the city's most stunning covered rooftop with just the right light for your special event or fine dining experience. An oasis in Midtown set against the beauty of New York City's skyline","Enchanting covered rooftop restaurant with lush greenery, fairy lights, and elegant table settings at Valbella At The Park","https://www.instagram.com/p/DOje_WBESHP/","SCRAPED"
"#nycrestaurants","DH11_HaRpeo","tooomuchfoood","March 31, 2025","2272","","#tooomuchfoood #nycfood #nycrestaurants #nycfoodie #nyclife #nyceats","March in food. Ranking 20 spots I tried based on food vibes and whether I see myself going back","Pasta dish at Parla restaurant rated 9.1/10 featuring fusilli with orange sauce","https://www.instagram.com/p/DH11_HaRpeo/","SCRAPED"
"#nycrestaurants","DRkSqKzDu03","rolfsny","November 27, 2025","1530","","#bucketlisters #nycgo #nycrestaurants #christmas #christmasinnewyork #holidaydecor #christmaslights #christmasdecor","Rolf's German Restaurant holiday decorations","Rolf's German Restaurant with elaborate Christmas decorations, thousands of ornaments, lights, and festive decor","https://www.instagram.com/p/DRkSqKzDu03/","SCRAPED"
"#nycrestaurants","DQFjs_nkgBf","itskimberlyfisher","October 22, 2025","798","","#nyc #nycrestaurants #blondes #blackandwhite","When your relationship is built off of a solid foundation of cocktails carbs and love for @michelinguide and fancy places","Two blonde women in white shirts holding cocktails at Fasano Restaurant New York","https://www.instagram.com/p/DQFjs_nkgBf/","SCRAPED"
